{
  "schema_version": 1,
  "reader_contract_version": 1,
  "source_issue_hash": "b0e7d7b1900114c04473fee839272cfdb203ae7b225757164830dd869918d83b",
  "issue_date": "2026-08-26",
  "headline": "AI语义Fabric技术情报（公测版）",
  "judgements": [
    {
      "title": "模型产出的代码靠提示词管不住，这批工作改用硬约束",
      "body": "SkillEffect在工具分派前让独立检查器重建有界版本再放行，配额实验里有界版本全部跑完，组合基线只完成不到四成。ECK把验证证据和新鲜度署名进代码单元，把证据藏起来后精确选择器从9/11掉到1/11。纳米光子学综述里的做法同路：给Claude接上专用求解器再让它写脚本，另一个框架让元Agent按确定性物理反馈改skill文件。管住模型输出的办法，正从写更好的提示词换成配上可执行、可检查的约束。",
      "evidence_item_ids": [
        "f5a9fafbe8d1f875de954234",
        "b54170ab85b9489beec0628b",
        "638b2a8a90c2dc3cd09202be"
      ]
    },
    {
      "title": "H100上多挂加载反而掉带宽，选对数据通路比堆深度值钱",
      "body": "CoreOptX在三颗H100上做了组受控微基准：普通全局加载的带宽在每线程深度约2处到顶，继续加深到8反而掉约三分之一，而cp.async在高深度下能到普通路径的两倍以上。同一期的rl-triton把七种RL递推改成片上结合扫描拿到数倍加速，却在寄存器溢出处退回0.6倍。写访存内核的顺序应该反过来：先选数据通路和片上驻留，再谈并发深度。",
      "evidence_item_ids": [
        "f8f301ea0089ea93988b7609",
        "e335e049f37fc68f6d8ad08a"
      ]
    },
    {
      "title": "改Harness的门槛降下来了，主要开销从训练挪到了评测",
      "body": "Task-CoEvolve让验证任务集跟着Harness一起演化，按候选分歧度挑任务，两成预算选出的Harness和全集合搜索只差一个点，搜索token省掉八成。Agent Lightning用约3500行框架接上部署用的同一个Harness做RL，6K样本把Qwen3.5在SWE-bench Verified上提了两位数点，训练脚本和数据管线都放出来了。照这个成本结构，Harness自改进可以按周排进常规迭代，不必再当专项立项。",
      "evidence_item_ids": [
        "1094ba4b35c2bf39739b2516",
        "da2cf54fbddebd9ce2de40f2"
      ]
    }
  ],
  "watch_next": [
    "LMCache舰队级blend查找的量化性能，看后续PR与部署数据",
    "H100加载深度结论在Blackwell上的复现与cp.async适配",
    "MLA异构秩分配的训练验证与KV量化叠加效果"
  ],
  "items": {
    "638b2a8a90c2dc3cd09202be": {
      "source_item_hash": "aaa801d272bab09ee1b0ae8c4cfae57b",
      "role": "core",
      "topic_id": "frontier_exploration",
      "direction_id": "agent_tooling_frontier",
      "published_at": "2026-08-18T19:57:16Z",
      "score": 96.34,
      "sources": [
        {
          "publisher": "arXiv",
          "url": "https://arxiv.org/abs/2608.18279v1",
          "source_level": "A",
          "primary": true,
          "published_at": "2026-08-18T19:57:16Z"
        }
      ],
      "title": "模型写工具代码不可靠，纳米光子学界先给出了两条解法",
      "lead": "别的领域先碰上了模型写工具代码不可靠的问题。这篇纳米光子学综述里值得单独看的是两条机制。给Claude Sonnet 4接上可微求解器TorchRDIT再写逆设计脚本，比走标准RAG少出错、少花算力；另一个框架让元Agent按确定性物理反馈更新人类可读的skill文件，完全不动模型权重。",
      "body": [
        "效果数字都来自综述转引，读的时候记住这层来源。skill文件演化把同类任务成功率从38%做到74%，更难的场景从20%到90%。",
        "我们自己的工具链可以照这两条做轻量验证。把提示工程换成结构化工具接入，用确定性反馈演化skill文件，成本远低于重训练。"
      ],
      "takeaway": null,
      "blocks": [
        {
          "heading_key": null,
          "text": "别的领域先碰上了模型写工具代码不可靠的问题。这篇纳米光子学综述里值得单独看的是两条机制。给Claude Sonnet 4接上可微求解器TorchRDIT再写逆设计脚本，比走标准RAG少出错、少花算力；另一个框架让元Agent按确定性物理反馈更新人类可读的skill文件，完全不动模型权重。"
        },
        {
          "heading_key": "result",
          "text": "效果数字都来自综述转引，读的时候记住这层来源。skill文件演化把同类任务成功率从38%做到74%，更难的场景从20%到90%。"
        },
        {
          "heading_key": "implication",
          "text": "我们自己的工具链可以照这两条做轻量验证。把提示工程换成结构化工具接入，用确定性反馈演化skill文件，成本远低于重训练。"
        }
      ]
    },
    "f8f301ea0089ea93988b7609": {
      "source_item_hash": "6bfc389166f78c69317006d6b29f72b4",
      "role": "core",
      "topic_id": "ai_chip_accelerator",
      "direction_id": "accelerator_architecture",
      "published_at": "2026-08-16T14:33:34Z",
      "score": 87.45,
      "sources": [
        {
          "publisher": "arXiv",
          "url": "https://arxiv.org/abs/2608.15764v1",
          "source_level": "A",
          "primary": true,
          "published_at": "2026-08-16T00:00:00Z"
        }
      ],
      "title": "H100上每线程加载深度堆到2以上，带宽反而掉三分之一",
      "lead": "写访存内核时常让每线程多挂几个在途加载。CoreOptX在三颗H100上做的净室微基准发现，普通全局加载的带宽在每线程加载深度K约等于2时就到顶，继续加深度反而往下掉。K从2加到8，带宽从约3050 GB/s降到1980 GB/s，两颗die上复现的降幅都在35%左右。",
      "body": [
        "反直觉的地方在计数器。这个过程里DRAM流量几乎没变，L2扇区流量却涨了约50%，把分配大小扫过40倍范围也改变不了降幅。论文只把K报告为软件ILP，底层机制留作开放问题，两次异常launch也没有解释。",
        "对我们的内核写法这是条可以直接执行的规矩。每线程普通加载深度别堆高，需要高在途深度时改用cp.async，那条路在高深度下能拿到普通加载2.1至2.9倍的带宽。"
      ],
      "takeaway": null,
      "blocks": [
        {
          "heading_key": null,
          "text": "写访存内核时常让每线程多挂几个在途加载。CoreOptX在三颗H100上做的净室微基准发现，普通全局加载的带宽在每线程加载深度K约等于2时就到顶，继续加深度反而往下掉。K从2加到8，带宽从约3050 GB/s降到1980 GB/s，两颗die上复现的降幅都在35%左右。"
        },
        {
          "heading_key": "contradiction",
          "text": "反直觉的地方在计数器。这个过程里DRAM流量几乎没变，L2扇区流量却涨了约50%，把分配大小扫过40倍范围也改变不了降幅。论文只把K报告为软件ILP，底层机制留作开放问题，两次异常launch也没有解释。"
        },
        {
          "heading_key": "implication",
          "text": "对我们的内核写法这是条可以直接执行的规矩。每线程普通加载深度别堆高，需要高在途深度时改用cp.async，那条路在高深度下能拿到普通加载2.1至2.9倍的带宽。"
        }
      ]
    },
    "1094ba4b35c2bf39739b2516": {
      "source_item_hash": "cd25fb25b0bace894d0c7c94560cce6c",
      "role": "core",
      "topic_id": "agent_acceleration",
      "direction_id": "agent_harness",
      "published_at": "2026-08-20T15:24:54Z",
      "score": 86.05,
      "sources": [
        {
          "publisher": "arXiv",
          "url": "https://arxiv.org/abs/2608.20169v1",
          "source_level": "A",
          "primary": true,
          "published_at": "2026-08-20T00:00:00Z"
        }
      ],
      "title": "Harness优化太贵，让验证任务集跟着一起演化",
      "lead": "自动改Harness的流程里，评测通常是大头。每轮把每个候选在整套验证任务上跑一遍，Terminal-Bench这类任务一次占沙盒几十分钟，评测费用压过优化本身。东京大学这篇让验证任务集跟着Harness一起演化，预算优先给候选之间结果分歧大的任务，再按采样概率把分数折算回全集，不同轮次之间仍然可比。",
      "body": [
        "数字很实在。两成预算下选出的Harness在Terminal-Bench均值51.7%，全集合搜索是52.8%；GPT-5.6-Luna的搜索token省了80%，时间从22.2小时压到11.5小时。",
        "方法有两条边。每个候选评多少任务事先定死，遇到明显更差的候选不能提前停；预算压到7%时估计器的秩相关只有0.13，排序基本不可用。"
      ],
      "takeaway": null,
      "blocks": [
        {
          "heading_key": null,
          "text": "自动改Harness的流程里，评测通常是大头。每轮把每个候选在整套验证任务上跑一遍，Terminal-Bench这类任务一次占沙盒几十分钟，评测费用压过优化本身。东京大学这篇让验证任务集跟着Harness一起演化，预算优先给候选之间结果分歧大的任务，再按采样概率把分数折算回全集，不同轮次之间仍然可比。"
        },
        {
          "heading_key": "result",
          "text": "数字很实在。两成预算下选出的Harness在Terminal-Bench均值51.7%，全集合搜索是52.8%；GPT-5.6-Luna的搜索token省了80%，时间从22.2小时压到11.5小时。"
        },
        {
          "heading_key": "boundary",
          "text": "方法有两条边。每个候选评多少任务事先定死，遇到明显更差的候选不能提前停；预算压到7%时估计器的秩相关只有0.13，排序基本不可用。"
        }
      ]
    },
    "a067fc83377ac89d0319999a": {
      "source_item_hash": "884011917e43c8e0ce3fc90c644bea58",
      "role": "core",
      "topic_id": "frontier_exploration",
      "direction_id": "agent_tooling_frontier",
      "published_at": "2026-08-20T17:57:00Z",
      "score": 85.6,
      "sources": [
        {
          "publisher": "arXiv",
          "url": "https://arxiv.org/abs/2608.20319v1",
          "source_level": "A",
          "primary": true,
          "published_at": "2026-08-20T00:00:00Z"
        }
      ],
      "title": "把日常电脑操作录制成可审计的任务模型，再变成Agent技能",
      "lead": "屏幕录制和键鼠事件里藏着大量没写下来的操作知识，难点在于真实工作是多线程交错的，低层事件看不出目标。TMI把无约束轨迹拆成一个个潜在任务，再给每个任务配两个模型，一个递归分解目标层级，一个用SEQ、WHILE、FOR表达过程，最后在形式约束下调和成统一模型。",
      "body": [
        "受控轨迹上交错任务的分组一致率ARI达到0.974，重建了74.9%的执行步骤，最强工作流归纳基线只有30.3%。从任务模型派生的技能让留存任务准确率比最强基线高30%，代码已经开源。",
        "30%那条没给出基线名字和绝对准确率。另外自然轨迹含个人信息，作者承认脱敏对归纳质量的影响还没评估。"
      ],
      "takeaway": null,
      "blocks": [
        {
          "heading_key": null,
          "text": "屏幕录制和键鼠事件里藏着大量没写下来的操作知识，难点在于真实工作是多线程交错的，低层事件看不出目标。TMI把无约束轨迹拆成一个个潜在任务，再给每个任务配两个模型，一个递归分解目标层级，一个用SEQ、WHILE、FOR表达过程，最后在形式约束下调和成统一模型。"
        },
        {
          "heading_key": "result",
          "text": "受控轨迹上交错任务的分组一致率ARI达到0.974，重建了74.9%的执行步骤，最强工作流归纳基线只有30.3%。从任务模型派生的技能让留存任务准确率比最强基线高30%，代码已经开源。"
        },
        {
          "heading_key": "boundary",
          "text": "30%那条没给出基线名字和绝对准确率。另外自然轨迹含个人信息，作者承认脱敏对归纳质量的影响还没评估。"
        }
      ]
    },
    "b54170ab85b9489beec0628b": {
      "source_item_hash": "5e1e9b96b3cb153ea5e36792371f2a2b",
      "role": "core",
      "topic_id": "agent_acceleration",
      "direction_id": "read_grep",
      "published_at": "2026-08-17T09:07:45Z",
      "score": 85.1,
      "sources": [
        {
          "publisher": "arXiv",
          "url": "https://arxiv.org/abs/2608.16295v1",
          "source_level": "A",
          "primary": true,
          "published_at": "2026-08-17T09:07:45Z"
        }
      ],
      "title": "验证证据和新鲜度直接署名进代码，检索摘要不用再猜",
      "lead": "编码Agent拿到检索片段，还是不知道哪个是业务规则、哪条测试管这段代码、摘要是不是过期了。ECK换了个方向，用装饰器把这些信息直接署名进代码单元。每个ECKU带身份、语义、契约、证据和查询接口，证据能执行，新鲜度能检查。",
      "body": [
        "消融把证据的价值量了出来。隐藏声明证据后，精确选择器从9/11掉到1/11；补丁影响对12条链接的精度和召回都是1.000；50个过期扰动里ECK全部检出，规则快照一个都没发现。",
        "对仓库索引方向，这套实验支持一个分层做法。规则文件继续当投递层，证据、影响和新鲜度放进源绑定对象里治理，别外置给摘要。17个单元只盖住11个补丁，也说明它替代不了检索。"
      ],
      "takeaway": null,
      "blocks": [
        {
          "heading_key": null,
          "text": "编码Agent拿到检索片段，还是不知道哪个是业务规则、哪条测试管这段代码、摘要是不是过期了。ECK换了个方向，用装饰器把这些信息直接署名进代码单元。每个ECKU带身份、语义、契约、证据和查询接口，证据能执行，新鲜度能检查。"
        },
        {
          "heading_key": "result",
          "text": "消融把证据的价值量了出来。隐藏声明证据后，精确选择器从9/11掉到1/11；补丁影响对12条链接的精度和召回都是1.000；50个过期扰动里ECK全部检出，规则快照一个都没发现。"
        },
        {
          "heading_key": "implication",
          "text": "对仓库索引方向，这套实验支持一个分层做法。规则文件继续当投递层，证据、影响和新鲜度放进源绑定对象里治理，别外置给摘要。17个单元只盖住11个补丁，也说明它替代不了检索。"
        }
      ]
    },
    "f5a9fafbe8d1f875de954234": {
      "source_item_hash": "efcdd727cbc72da67b1a9c9ed537a282",
      "role": "core",
      "topic_id": "agent_acceleration",
      "direction_id": "tool_chain",
      "published_at": "2026-08-17T18:03:56Z",
      "score": 82.95,
      "sources": [
        {
          "publisher": "arXiv",
          "url": "https://arxiv.org/abs/2608.17007v1",
          "source_level": "A",
          "primary": true,
          "published_at": "2026-08-17T18:03:56Z"
        }
      ],
      "title": "工具代码先过独立检查再执行，单次调用内存有了上界",
      "lead": "模型生成的工具代码哪怕语义对，也可能把整个输入读进内存。smolagents里16个本来有效的工具调用，在没有资源反馈时全部选了急切访问模式。SkillEffect在分派前加了一道独立检查，从提交的程序和不可变输入重建一个有界版本，通过后才放行执行。",
      "body": [
        "六个算子族最大输入下峰值内存降3.75至24.25倍，中位8.45倍。2GiB配额内有界版本完成全部提交，组合基线只完成37.5%，无配额对照里验证goodput还升了17.9%。",
        "适用面要先看清。它只管确定性、本地、只读的工具程序，每类计算都要先写审计过的关系插件，支付和邮件这类不可逆远程效果需要另外的事务协议。"
      ],
      "takeaway": null,
      "blocks": [
        {